{
  "schema": "roguelike_card_game.localization.v1",
  "content_version": "mvp.1.0-draft",
  "locale": "zh-Hans",
  "entries": {
    "weapon.revolver_sword.name": "左轮剑",
    "weapon.revolver_sword.description": "剑与枪的结合，通过剑术斩击积蓄彩能，再以枪形态倾泻爆发。",
    "weapon.mechanical_arm.name": "机械臂",
    "weapon.mechanical_arm.description": "高科技义肢，擅长护盾、防反、控制与稳定产出彩能。",

    "card.revolver_slash.name": "斩击",
    "card.revolver_slash.rules": "1 费行动牌。对单体魔物造成 6 点伤害，生成 1 点附魔颜色的彩能；未附魔时生成无色彩能。",
    "card.revolver_slash.flavor": "最朴素的一剑，把失色的空气切开。",
    "card.revolver_double_slash.name": "二连斩",
    "card.revolver_double_slash.rules": "1 费行动牌。对单体魔物造成 2 段 4 点伤害，生成 2 点附魔颜色的彩能。",
    "card.revolver_double_slash.flavor": "第一剑校准距离，第二剑把彩能压进剑脊。",
    "card.revolver_quick_thrust.name": "快速突刺",
    "card.revolver_quick_thrust.rules": "0 费行动牌。对单体魔物造成 3 点伤害，生成 1 点附魔颜色的彩能。",
    "card.revolver_quick_thrust.flavor": "动作轻到像一次呼吸，却足够点燃弹仓。",
    "card.revolver_heavy_cannon.name": "重炮",
    "card.revolver_heavy_cannon.rules": "终结牌。消耗 3 点任意彩能，对单体魔物造成 22 点伤害，并按消耗彩能颜色触发追加效果。",
    "card.revolver_heavy_cannon.flavor": "剑身折成枪口，轰鸣声把黑塔的尘埃震落。",
    "card.revolver_bullet_storm.name": "子弹风暴",
    "card.revolver_bullet_storm.rules": "终结牌。消耗 X 点任意彩能，至少 2 点；每点彩能对随机魔物造成 5 点伤害，并按消耗彩能颜色触发追加效果。",
    "card.revolver_bullet_storm.flavor": "不问目标，只问弹仓里还有多少颜色。",
    "card.revolver_reload_slash.name": "装填斩",
    "card.revolver_reload_slash.rules": "1 费行动牌。对单体魔物造成 7 点伤害，生成 1 点附魔颜色的彩能；本回合下一张终结牌伤害提高 4 点。",
    "card.revolver_reload_slash.flavor": "斩击是装填，火光是回答。",
    "card.revolver_gunblade_calibration.name": "枪剑校准",
    "card.revolver_gunblade_calibration.rules": "1 费行动牌。抽 1 张牌，生成 1 点附魔颜色的彩能；本回合下一张终结牌彩能需求 -1，最低为 1。",
    "card.revolver_gunblade_calibration.flavor": "左听见茵留下的齿轮声，又快又准。",
    "card.revolver_whirling_sword_dance.name": "回旋剑舞",
    "card.revolver_whirling_sword_dance.rules": "2 费行动牌。对所有魔物造成 2 段 3 点伤害，生成 3 点附魔颜色的彩能。",
    "card.revolver_whirling_sword_dance.flavor": "剑光绕场一周，像给灰白世界描上临时的圆。",
    "card.revolver_piercing_bullet_line.name": "贯穿弹线",
    "card.revolver_piercing_bullet_line.rules": "1 费行动牌。对单体魔物造成 7 点伤害，生成 1 点附魔颜色的彩能；若目标带有负面状态，追加 5 点伤害。",
    "card.revolver_piercing_bullet_line.flavor": "被机械臂锁住的破绽，会被子弹排成一条线。",
    "card.revolver_rift_quickdraw.name": "裂隙拔枪",
    "card.revolver_rift_quickdraw.rules": "终结牌。消耗 4 点任意彩能，对单体魔物造成 28 点伤害；若击杀目标，抽 1 张行动牌并获得 1 点行动点。",
    "card.revolver_rift_quickdraw.flavor": "枪声先至，裂隙随后才学会闭合。",

    "card.arm_guard.name": "格挡",
    "card.arm_guard.rules": "1 费行动牌。获得 7 点防御，生成 1 点附魔颜色的彩能。",
    "card.arm_guard.flavor": "机械臂张开粒子盾，把下一次失误挡在外面。",
    "card.arm_bind.name": "束缚",
    "card.arm_bind.rules": "1 费行动牌。束缚单体魔物 1 回合，生成 1 点附魔颜色的彩能。",
    "card.arm_bind.flavor": "银色夹爪扣住影子，魔物的动作慢了半拍。",
    "card.arm_crush.name": "重压",
    "card.arm_crush.rules": "1 费行动牌。使单体魔物本回合受到的伤害提高，生成 1 点附魔颜色的彩能。",
    "card.arm_crush.flavor": "不是砸碎外壳，而是让裂纹自己说话。",
    "card.arm_army_sweep.name": "横扫千军",
    "card.arm_army_sweep.rules": "终结牌。消耗 4 点任意彩能，对所有魔物造成 14 点伤害，并按消耗彩能颜色触发追加效果。",
    "card.arm_army_sweep.flavor": "机械臂横过战场，像把黑塔的阴影推回墙上。",
    "card.arm_counter.name": "反击",
    "card.arm_counter.rules": "终结牌。消耗 2 点任意彩能，对单体魔物造成等同当前防御值的伤害，并按消耗彩能颜色触发追加效果。",
    "card.arm_counter.flavor": "挡下来的每一击，都会被原样奉还。",
    "card.arm_energy_veil.name": "能量护幕",
    "card.arm_energy_veil.rules": "2 费行动牌。获得 14 点防御，生成 2 点附魔颜色的彩能；若本回合未打出左轮剑牌，额外获得 4 点防御。",
    "card.arm_energy_veil.flavor": "护幕展开时，连灰尘都被挡成整齐的线。",
    "card.arm_shock_palm.name": "震荡掌",
    "card.arm_shock_palm.rules": "1 费行动牌。对所有魔物造成 3 点伤害，并使其下次攻击降低 2 点；生成 1 点附魔颜色的彩能。",
    "card.arm_shock_palm.flavor": "一掌按下，空气里的噪音先碎了。",
    "card.arm_traction_grab.name": "牵引抓取",
    "card.arm_traction_grab.rules": "1 费行动牌。对单体魔物造成 4 点伤害并施加牵引：本回合下一次单体攻击对其伤害提高；生成 1 点附魔颜色的彩能。",
    "card.arm_traction_grab.flavor": "把目标从混乱里拽出来，再交给左轮剑。",
    "card.arm_repair_protocol.name": "维修协议",
    "card.arm_repair_protocol.rules": "1 费行动牌。获得 4 点防御，生成 1 点附魔颜色的彩能；若当前生命低于一半，回复 5 点生命。",
    "card.arm_repair_protocol.flavor": "临时焊点也许粗糙，但足够撑过下一轮。",
    "card.arm_shield_overload.name": "护盾过载",
    "card.arm_shield_overload.rules": "终结牌。消耗全部彩能，至少 2 点；每点彩能获得 5 点防御，随后对所有魔物造成本次获得防御一半的伤害，并按消耗彩能颜色触发追加效果。",
    "card.arm_shield_overload.flavor": "当护盾亮到极限，它就不再只是护盾。",

    "card.basic_strike.name": "基础斩击",
    "card.basic_strike.rules": "造成 6 点伤害。行动牌，生成 1 点无色彩能。",
    "card.basic_strike.flavor": "最稳定的起手斩击。",
    "card.quick_jab.name": "迅捷刺击",
    "card.quick_jab.rules": "造成 3 点伤害。0 费行动牌，生成 1 点无色彩能。",
    "card.quick_jab.flavor": "轻巧刺击，用来启动连段。",
    "card.heavy_strike.name": "重斩",
    "card.heavy_strike.rules": "造成 13 点伤害。2 费行动牌，生成 1 点无色彩能。",
    "card.heavy_strike.flavor": "用行动点换取更重的一击。",
    "card.flow_step.name": "流步",
    "card.flow_step.rules": "造成 4 点伤害。0 费行动牌，生成 1 点无色彩能。",
    "card.flow_step.flavor": "在移动中补上节奏。",
    "card.guard_break.name": "破防重击",
    "card.guard_break.rules": "造成 15 点伤害。2 费行动牌，生成 1 点无色彩能。",
    "card.guard_break.flavor": "把防线撕开的一记重击。",
    "card.basic_guard.name": "基础防御",
    "card.basic_guard.rules": "获得 6 点防御，并获得 1 点当前回合行动点。",
    "card.basic_guard.flavor": "稳住架势，等待反击窗口。",
    "card.tactical_read.name": "战术观察",
    "card.tactical_read.rules": "抽 2 张牌。",
    "card.tactical_read.flavor": "读清魔物的下一步。",
    "card.second_wind.name": "回稳",
    "card.second_wind.rules": "获得 4 点防御，并获得 1 点当前回合行动点。",
    "card.second_wind.flavor": "重新调整呼吸。",
    "card.deep_focus.name": "深度专注",
    "card.deep_focus.rules": "抽 2 张牌。",
    "card.deep_focus.flavor": "把杂念压到剑锋之外。",
    "card.setup_discount.name": "预备减费",
    "card.setup_discount.rules": "本回合手牌中的行动牌临时费用 -1。当前为 MVP 占位效果。",
    "card.setup_discount.flavor": "提前铺好下一段动作。",
    "card.burst_finish.name": "爆裂终结",
    "card.burst_finish.rules": "需要 3 点彩能。造成 18 点伤害，并按消耗颜色触发追加效果。",
    "card.burst_finish.flavor": "把彩能压缩成单点爆发。",
    "card.arc_sweep_finish.name": "弧光横扫",
    "card.arc_sweep_finish.rules": "需要 3 点彩能。对所有魔物造成 10 点伤害，并按消耗颜色触发追加效果。",
    "card.arc_sweep_finish.flavor": "一道弧光扫过整条战线。",
    "card.refund_finish.name": "回流终结",
    "card.refund_finish.rules": "需要 3 点彩能。造成 14 点伤害，并按消耗颜色触发追加效果。",
    "card.refund_finish.flavor": "终结之后仍有余势。",
    "card.bulwark_finish.name": "壁垒终结",
    "card.bulwark_finish.rules": "需要 3 点彩能。获得 16 点防御，并按消耗颜色触发追加效果。",
    "card.bulwark_finish.flavor": "把攻势收束成坚固防线。",

    "relic.mvp_color_spark.name": "彩能火花",
    "relic.mvp_color_spark.rules": "每回合第一次使用行动牌时，获得 2 点防御。",

    "enemy.training_dummy.name": "训练假人",
    "enemy.training_dummy.intent.attack": "攻击：造成 5 点伤害。",
    "enemy.intent_scout.name": "意图斥候",
    "enemy.intent_scout.intent.attack": "攻击：造成 7 点伤害。",
    "enemy.intent_scout.intent.guard": "防守：获得 5 点防御。",
    "enemy.splitling.name": "分裂小怪",
    "enemy.splitling.intent.attack": "攻击：造成 4 点伤害。",
    "enemy.elite_guardian.name": "精英守卫",
    "enemy.elite_guardian.intent.attack": "攻击：造成 11 点伤害。",
    "enemy.elite_guardian.intent.guard": "防守：获得 7 点防御。",
    "enemy.relic_tester.name": "余烬试炼者",
    "enemy.relic_tester.intent.attack": "攻击：造成 9 点伤害。",
    "enemy.black_tower_warden.name": "黑塔看守",
    "enemy.black_tower_warden.intent.attack": "攻击：造成 12 点伤害。",
    "enemy.black_tower_warden.intent.pressure": "压迫：造成 7 点伤害，并获得 5 点防御。",

    "encounter.mvp.normal_01.goal": "教学：行动点、出牌与彩能。",
    "encounter.mvp.normal_02.goal": "教学：魔物意图与防御。",
    "encounter.mvp.normal_03.goal": "教学：多魔物与目标选择。",
    "encounter.mvp.elite_01.goal": "检验：攻防节奏。",
    "encounter.mvp.normal_04.goal": "试用：遗物与新卡。",
    "encounter.mvp.boss_01.goal": "综合检验：行动点、彩能、终结牌、防御与构筑奖励。"
  }
}
